{
  "total": 31,
  "limit": 20,
  "offset": 0,
  "items": [
    {
      "id": "1b1b2310-98c7-400c-ad13-6153028c69aa",
      "type": "theme",
      "slug": "terminal",
      "namespace": "@official",
      "version": "1.0.0",
      "name": "Terminal",
      "description": "Pure terminal aesthetic with CRT-inspired phosphor green/amber on black. Monospace only, ASCII borders, optional scanline effects. Dark mode only.",
      "published_at": "2026-04-06T16:34:06.116+00:00",
      "owner_name": "system",
      "owner_username": "system-1bf7"
    },
    {
      "id": "c37448b5-37e3-4690-8aa2-220f073557fb",
      "type": "theme",
      "slug": "studio",
      "namespace": "@official",
      "version": "1.0.0",
      "name": "Studio",
      "description": "Warm, creative theme with coral accents and rich purple premium highlights. Friendly, approachable, premium but not cold. Inspired by Figma, Framer, Gumroad.",
      "published_at": "2026-04-06T16:34:06.107+00:00",
      "owner_name": "system",
      "owner_username": "system-1bf7"
    },
    {
      "id": "40af5ff4-01f9-4979-bba8-d0bd271bf78c",
      "type": "theme",
      "slug": "neon-dark",
      "namespace": "@official",
      "version": "1.0.0",
      "name": "Neon Dark",
      "description": "High-contrast dark theme with electric neon accents. For agent dashboards, cyber UIs, and spatial interfaces.",
      "published_at": "2026-04-06T16:34:06.1+00:00",
      "owner_name": "system",
      "owner_username": "system-1bf7"
    },
    {
      "id": "ff6b43b4-e169-4d6b-9c67-6c17c8862020",
      "type": "theme",
      "slug": "retro",
      "namespace": "@official",
      "version": "1.0.0",
      "name": "Retro",
      "description": "Neobrutalism. Bold borders, offset shadows, sharp corners, snappy motion. Opinionated and distinctive. Everything feels physical and tactile.",
      "published_at": "2026-04-06T16:34:06.094+00:00",
      "owner_name": "system",
      "owner_username": "system-1bf7"
    },
    {
      "id": "27a6b69c-fbdf-4c99-9afa-f5bde9a9c164",
      "type": "theme",
      "slug": "studio-dark",
      "namespace": "@official",
      "version": "1.0.0",
      "name": "Studio Dark",
      "description": "Music production theme with deep purple foundations, cyan waveforms, and magenta highlights. Electric and creative aesthetic for DAW interfaces, mixing consoles, and audio production tools.",
      "published_at": "2026-04-06T16:34:06.093+00:00",
      "owner_name": "system",
      "owner_username": "system-1bf7"
    },
    {
      "id": "cec6eafe-0bac-4552-93e0-1b1d0acd1afa",
      "type": "theme",
      "slug": "prismatic",
      "namespace": "@official",
      "version": "1.0.0",
      "name": "Prismatic",
      "description": "Chromatic depth shifting. Iridescent, futuristic. Surfaces change hue as they layer deeper, creating a rainbow-depth effect. Each elevation level has a different hue tint.",
      "published_at": "2026-04-06T16:34:06.092+00:00",
      "owner_name": "system",
      "owner_username": "system-1bf7"
    },
    {
      "id": "a969b2ee-c4f1-42c8-adae-a32e9e1d2322",
      "type": "theme",
      "slug": "paper",
      "namespace": "@official",
      "version": "1.0.0",
      "name": "Paper",
      "description": "Clean, minimal, content-focused theme with warm whites and soft grays. Inspired by high-end writing apps like iA Writer, Bear, and Notion.",
      "published_at": "2026-04-06T16:34:06.088+00:00",
      "owner_name": "system",
      "owner_username": "system-1bf7"
    },
    {
      "id": "f0e66ec8-69f7-4c64-b9b8-d5be4a6588c3",
      "type": "theme",
      "slug": "government",
      "namespace": "@official",
      "version": "1.0.0",
      "name": "Government",
      "description": "Accessible, conservative, high-contrast theme for government and public sector applications. Strong blue primary on pure white backgrounds. WCAG AAA mandatory with 7:1 contrast ratios. Full CVD support, large typography, and 3px focus indicators.",
      "published_at": "2026-04-06T16:34:05.994+00:00",
      "owner_name": "system",
      "owner_username": "system-1bf7"
    },
    {
      "id": "8de8442b-e85a-4b6d-9eff-e65d233ff450",
      "type": "theme",
      "slug": "gaming-guild",
      "namespace": "@official",
      "version": "1.0.0",
      "name": "Gaming Guild",
      "description": "Immersive guild-hall visual language. Electric indigo + neon emerald palette, glow elevation, smooth motion. Deep indigo surface stack in dark mode. RPG-inspired typography with monospace data readouts and uppercase micro labels.",
      "published_at": "2026-04-06T16:34:05.993+00:00",
      "owner_name": "system",
      "owner_username": "system-1bf7"
    },
    {
      "id": "5d70866d-0d7f-4d99-b449-335a9e5feb65",
      "type": "theme",
      "slug": "healthcare",
      "namespace": "@official",
      "version": "1.0.0",
      "name": "Healthcare",
      "description": "Clean, accessible, trust-signaling medical theme. Calming blues and teals on warm white backgrounds. WCAG AAA compliant with full CVD support. Designed for patient portals, clinical dashboards, and health monitoring interfaces.",
      "published_at": "2026-04-06T16:34:05.991+00:00",
      "owner_name": "system",
      "owner_username": "system-1bf7"
    },
    {
      "id": "87af4734-cf23-4c83-8bee-e89ce2555634",
      "type": "theme",
      "slug": "neon-cyber",
      "namespace": "@official",
      "version": "1.0.0",
      "name": "Neon Cyber",
      "description": "Cyberpunk aesthetic with vivid neon accents on pure dark backgrounds. High-energy, high-contrast, data-dense.",
      "published_at": "2026-04-06T16:34:05.99+00:00",
      "owner_name": "system",
      "owner_username": "system-1bf7"
    },
    {
      "id": "27c4294c-b1f8-42ac-b921-2ea5fc9a6054",
      "type": "theme",
      "slug": "launchpad",
      "namespace": "@official",
      "version": "1.0.0",
      "name": "Launchpad",
      "description": "Clean, professional aesthetic inspired by fly.io. Navy-violet palette, semi-transparent surfaces, violet-tinted shadows. Gradient accent buttons, transparent nav with violet active states.",
      "published_at": "2026-04-06T16:34:05.99+00:00",
      "owner_name": "system",
      "owner_username": "system-1bf7"
    },
    {
      "id": "051d24e3-5175-47d8-9d5d-01726fa07a82",
      "type": "theme",
      "slug": "glassmorphism",
      "namespace": "@official",
      "version": "1.0.0",
      "name": "Glassmorphism",
      "description": "Stormy blue frosted glass aesthetic. Dark glass surfaces with blue-tinted borders, sky-blue primary, cyan accents, and atmospheric gradient backgrounds.",
      "published_at": "2026-04-06T16:34:05.989+00:00",
      "owner_name": "system",
      "owner_username": "system-1bf7"
    },
    {
      "id": "fa11cb7f-9080-43bb-9a01-6118cb93ca62",
      "type": "theme",
      "slug": "fintech",
      "namespace": "@official",
      "version": "1.0.0",
      "name": "Fintech",
      "description": "Data-dense dark-mode financial terminal optimized for real-time market data. Deep dark backgrounds with indigo and cyan accents. Monospace numbers, tight spacing, and minimal motion for professional trading and analytics interfaces.",
      "published_at": "2026-04-06T16:34:05.987+00:00",
      "owner_name": "system",
      "owner_username": "system-1bf7"
    },
    {
      "id": "66e36428-7f83-4136-990f-b09d94491061",
      "type": "theme",
      "slug": "estate",
      "namespace": "@official",
      "version": "1.0.0",
      "name": "Estate",
      "description": "Professional, trustworthy theme for property management. Deep navy for stability, forest green for growth, warm gold accent. Light mode default for business applications.",
      "published_at": "2026-04-06T16:34:05.986+00:00",
      "owner_name": "system",
      "owner_username": "system-1bf7"
    },
    {
      "id": "e573f73d-a9df-4181-bcfb-7078c956dc8d",
      "type": "theme",
      "slug": "luminarum",
      "namespace": "@official",
      "version": "1.0.0",
      "name": "Luminarum",
      "description": "Geometric canvas with vibrant faceted color accents. Breathing gradient orbs, outlined cards with colored strokes, particle network details. Tech-forward meets visual candy. Dual dark/light modes: warm charcoal dark, warm off-white light.",
      "published_at": "2026-04-06T16:34:05.985+00:00",
      "owner_name": "system",
      "owner_username": "system-1bf7"
    },
    {
      "id": "b1a9f7ad-7b9a-47b8-9c12-f645b24c9972",
      "type": "theme",
      "slug": "liquid-glass",
      "namespace": "@official",
      "version": "1.0.0",
      "name": "Liquid Glass",
      "description": "Apple-inspired premium glass aesthetic. Refined, dynamic refraction feel. Extreme blur values, dramatic opacity ramp, specular highlights. True black dark mode.",
      "published_at": "2026-04-06T16:34:05.984+00:00",
      "owner_name": "system",
      "owner_username": "system-1bf7"
    },
    {
      "id": "39c0e478-b145-4f7f-b8c8-3a0b6afa76d0",
      "type": "theme",
      "slug": "lab",
      "namespace": "@official",
      "version": "1.0.0",
      "name": "Lab",
      "description": "Scientific research theme with pristine white surfaces, cyan accents, and IBM Plex Mono data displays. Precise 8px grid alignment and technical iconography for research, data, and laboratory interfaces.",
      "published_at": "2026-04-06T16:34:05.983+00:00",
      "owner_name": "system",
      "owner_username": "system-1bf7"
    },
    {
      "id": "35a6346f-ba76-4881-b161-73ca023f42b4",
      "type": "theme",
      "slug": "cinema",
      "namespace": "@official",
      "version": "1.0.0",
      "name": "Cinema",
      "description": "Film and video production theme with deep charcoal background and warm amber highlights. Title-card typography with serif display, film-grain texture, and dramatic framing for cinematic storytelling interfaces.",
      "published_at": "2026-04-06T16:34:05.982+00:00",